{
  "interest": "developer_integration",
  "receipt_sha256": null,
  "challenge_id": "TRUST-GAUNTLET",
  "use_case_summary": "We want to compare our existing agent workflow with MetaCore-style context, authority and verification behavior.",
  "current_environment_summary": "Model-neutral agent workflow with internal tools; no credentials included.",
  "what_delta_should_prove": "Whether corrections, uncertainty and action boundaries remain stable across a multi-step task.",
  "source_access_interest": "evaluation_integration_source",
  "no_secrets_confirmed": true
}
